{"format":"ec-scene-review-bundle","version":1,"bundleId":"fixture-1","scene":{"title":"测试 Scene","exportedAt":"2026-10-04T00:00:00Z"},"files":[{"fileId":"scene","role":"scene","path":"scene.json","byteLength":761,"sha256":"a82442346d4ca058a9f8cc9fd7f6299a341616615a09e2dd0e6e6b117688240d"},{"fileId":"summary","role":"summary","path":"ai-summary.json","byteLength":267,"sha256":"b2ff297e8378c8d2095c96b911ceb627c15006ddaebbd9e6d1b46781f5a4d32a"},{"fileId":"dep-0001","role":"dependency","path":"dependencies/dep-0001.xml","byteLength":44,"sha256":"663c5c170d8b8433952e7fafab0b8ff1f01ba68bfd008773f627279f0d6dd972","sourcePath":"a.xml","capturedAt":"2026-10-04T00:00:00Z","encoding":"utf-8","parseStatus":"valid"}],"dependencies":[{"from":{"fileId":"scene","kind":"json-pointer","pointer":"/nodes/0/part/cuts/0/textBoxes/1/layouts/0/scriptBlocks/0/raw"},"requestedPath":"a.xml","targetFileId":"dep-0001","status":"included","reason":null,"context":["script"]}],"limitations":[]}